{
  "dataset_id": "pfbench",
  "scenario_id": "scn_case14_1f939718742a",
  "question_id": "q_scn_case14_1f939718742a_direct_bus_vm",
  "source_case": "case14",
  "split": "dev",
  "query_family": "direct_bus_vm",
  "evaluation_mode": "tool_or_structured_context_required",
  "prompt": "Scenario ID: scn_case14_1f939718742a. Base case case14; mutations: scale load at bus 3 by P×1.0149 and Q×1.0242; scale load at bus 5 by P×1.1387 and Q×0.9794; scale load at bus 10 by P×0.9551 and Q×1.1041. Using the scenario record for this modified network, run AC power flow and report the voltage magnitude at bus 10. Return JSON.",
  "response_schema": {
    "type": "object",
    "additionalProperties": false,
    "properties": {
      "bus_id": {
        "type": "integer"
      },
      "vm_pu": {
        "type": "number"
      }
    },
    "required": [
      "bus_id",
      "vm_pu"
    ]
  },
  "gold_answer": {
    "bus_id": 10,
    "vm_pu": 1.050277
  },
  "grader": {
    "type": "json_numeric_tolerance",
    "float_tol": 0.0001,
    "required_fields": [
      "bus_id",
      "vm_pu"
    ]
  },
  "scenario_digest": {
    "num_buses": 14,
    "num_generators": 5,
    "num_branches": 20,
    "num_active_branches": 20,
    "mutation_ops": [
      "scale_bus_load",
      "scale_bus_load",
      "scale_bus_load"
    ],
    "bus_partition": {
      "slack_bus_ids": [
        1
      ],
      "pv_bus_ids": [
        2,
        3,
        6,
        8
      ],
      "pq_bus_ids": [
        4,
        5,
        7,
        9,
        10,
        11,
        12,
        13,
        14
      ]
    },
    "total_pd_mw": 261.0536,
    "total_qd_mvar": 74.53062,
    "total_scheduled_pg_mw": 272.4
  },
  "provenance": {
    "gold_source": "solver_truth",
    "scenario_artifact": "scenarios.jsonl",
    "pipeline": "pfbench_phase1",
    "dataset_version": "1.1.0"
  },
  "metadata": {
    "solver_mode": "ac",
    "target_bus_id": 10,
    "tool_required": true
  }
}
